{"schema":"dinhot.index/v1","engine_version":"0.00.000","default_case":"FX01_fixture","cases":[{"case_id":"C11_fixture","title":{"en":"Fixture case outside the field","es":"Caso de prueba fuera del campo"},"category":{"en":"Fixtures","es":"Datos de prueba"},"path":null,"status":"refused","reason":{"en":"A trap lies outside the unaliased field of view (abs(x) at most 665.0 um).","es":"Una trampa queda fuera del campo de visión sin solapamiento (abs(x) como máximo 665,0 um)."}},{"case_id":"FX01_fixture","title":{"en":"Fixture case","es":"Caso de prueba"},"category":{"en":"Fixtures","es":"Datos de prueba"},"path":"manifests/FX01_fixture.json","status":"baked","reason":null}]}