{"schema":"dinhot.index/v1","engine_version":"0.02.001","default_case":"C02_grid_feedback","cases":[{"case_id":"C01_square_grid","title":{"en":"Small square grid, 3 x 3","es":"Matriz cuadrada pequeña, 3 x 3"},"category":{"en":"Arrays","es":"Matrices"},"path":"manifests/C01_square_grid.json","status":"baked","reason":null},{"case_id":"C02_grid_feedback","title":{"en":"Grid with camera feedback, 10 x 10","es":"Matriz con retroalimentación de cámara, 10 x 10"},"category":{"en":"Arrays","es":"Matrices"},"path":"manifests/C02_grid_feedback.json","status":"baked","reason":null},{"case_id":"C03_large_array","title":{"en":"Large array, 32 x 32 = 1024 traps","es":"Matriz grande, 32 x 32 = 1024 trampas"},"category":{"en":"Arrays","es":"Matrices"},"path":"manifests/C03_large_array.json","status":"baked","reason":null},{"case_id":"C04_disc_crosstalk","title":{"en":"Disc potential with the crosstalk model","es":"Potencial de disco con el modelo de diafonía"},"category":{"en":"Shaped and 3D","es":"Formas y 3D"},"path":"manifests/C04_disc_crosstalk.json","status":"baked","reason":null},{"case_id":"C05_multiplane_vortices","title":{"en":"Three-plane array with vortices","es":"Matriz de tres planos con vórtices"},"category":{"en":"Shaped and 3D","es":"Formas y 3D"},"path":"manifests/C05_multiplane_vortices.json","status":"baked","reason":null},{"case_id":"C06_vortex_ring_line","title":{"en":"Vortex ring plus a line of traps","es":"Anillo de vórtices más una línea de trampas"},"category":{"en":"Shaped and 3D","es":"Formas y 3D"},"path":"manifests/C06_vortex_ring_line.json","status":"baked","reason":null},{"case_id":"C07_high_na","title":{"en":"High numerical aperture, 5 x 5","es":"Apertura numérica alta, 5 x 5"},"category":{"en":"Device and optics","es":"Dispositivo y óptica"},"path":"manifests/C07_high_na.json","status":"baked","reason":null},{"case_id":"C08_device_limited","title":{"en":"Device-limited array, 4-bit phase and crosstalk","es":"Matriz limitada por el dispositivo, fase de 4 bits y diafonía"},"category":{"en":"Device and optics","es":"Dispositivo y óptica"},"path":"manifests/C08_device_limited.json","status":"baked","reason":null},{"case_id":"C09_aberrated","title":{"en":"Aberrated array, with and without correction","es":"Matriz aberrada, con y sin corrección"},"category":{"en":"Device and optics","es":"Dispositivo y óptica"},"path":"manifests/C09_aberrated.json","status":"baked","reason":null},{"case_id":"C10_rearrangement","title":{"en":"Rearrangement sequence, 100 sites","es":"Secuencia de reordenamiento, 100 sitios"},"category":{"en":"Dynamics and controls","es":"Dinámica y controles"},"path":"manifests/C10_rearrangement.json","status":"baked","reason":null},{"case_id":"C11_outside_field","title":{"en":"A trap outside the field of view (refused)","es":"Una trampa fuera del campo de visión (rechazado)"},"category":{"en":"Dynamics and controls","es":"Dinámica y controles"},"path":null,"status":"refused","reason":{"en":"trap 0 has x_um=200 um, outside the unaliased field of view (abs must be below 127.5 um = lambda f / (2 p))","es":"la trampa 0 tiene x_um=200 um, fuera del campo de visión sin solapamiento (abs debe ser menor que 127.5 um = lambda f / (2 p))"}},{"case_id":"C12_calibration","title":{"en":"Calibration: the 10 x 10 task of the baselines","es":"Calibración: la tarea 10 x 10 de las líneas base"},"category":{"en":"Arrays","es":"Matrices"},"path":"manifests/C12_calibration.json","status":"baked","reason":null},{"case_id":"C13_disordered_array","title":{"en":"Disordered array, 819 traps","es":"Matriz desordenada, 819 trampas"},"category":{"en":"Arrays","es":"Matrices"},"path":"manifests/C13_disordered_array.json","status":"baked","reason":null},{"case_id":"C14_volume_learned","title":{"en":"Three-plane volume at the learned model's geometry","es":"Volumen de tres planos en la geometría del modelo aprendido"},"category":{"en":"Shaped and 3D","es":"Formas y 3D"},"path":"manifests/C14_volume_learned.json","status":"baked","reason":null}]}